### ISSUE TITLE
Node drop connection with rosmaster

### ISSUE THREAD

**Issue by iceuw** [ros/ros_comm#2382]
All nodes suddenly go offline in ros abnormally while running. And when I using rosnode list, it returns empty. But the node programs have not crashed which can be saw in top. Moreover, restarting roscore and the nodes will quickly lead to this situation again. Only complete reboot of the machine will temporarily resolve the issue for a short period.

![image](https://github.com/user-attachments/assets/0d1ed859-e4f5-45ba-bc44-9a43ca6c126e)

And I added the call stack of unregisterPublisher function in ros master. I got this information below

`
[rosmaster.master][INFO] 2024-12-19 13:48:07,997: -PUB [/z_localizer/png_map] /z_localizer/pigen_map_server http://user-IB-ITLU-AGV1:46179/. Traceback is ['  File "/usr/lib/python3.8/threading.py", line 890, in _bootstrap\n    self._bootstrap_inner()\n', '  File "/usr/lib/python3.8/threading.py", line 932, in _bootstrap_inner\n    self.run()\n', '  File "/usr/lib/python3.8/threading.py", line 870, in run\n    self._target(*self._args, **self._kwargs)\n', '  File "/usr/lib/python3.8/socketserver.py", line 683, in process_request_thread\n    self.finish_request(request, client_address)\n', '  File "/usr/lib/python3.8/socketserver.py", line 360, in finish_request\n    self.RequestHandlerClass(request, client_address, self)\n', '  File "/usr/lib/python3.8/socketserver.py", line 747, in __init__\n    self.handle()\n', '  File "/usr/lib/python3.8/http/server.py", line 427, in handle\n    self.handle_one_request()\n', '  File "/usr/lib/python3.8/http/server.py", line 415, in handle_one_request\n    method()\n', '  File "/usr/lib/python3.8/xmlrpc/server.py", line 515, in do_POST\n    response = self.server._marshaled_dispatch(\n', '  File "/usr/lib/python3.8/xmlrpc/server.py", line 263, in _marshaled_dispatch\n    response = self._dispatch(method, params)\n', '  File "/usr/lib/python3.8/xmlrpc/server.py", line 430, in _dispatch\n    return func(*params)\n', '  File "/opt/ros/noetic/lib/python3/dist-packages/rosmaster/master_api.py", line 177, in validated_f\n    code, msg, val = f(*newArgs, **kwds)\n', '  File "/opt/ros/noetic/lib/python3/dist-packages/rosmaster/master_api.py", line 790, in unregisterPublisher\n    mloginfo("-PUB [%s] %s %s. Traceback is %s",topic, caller_id, caller_api, traceback.format_stack())\n']
[rosmaster.master][INFO] 2024-12-19 13:48:08,007: -SUB [/z_localizer/map/pc] /z_localizer/pigen_map_server http://user-IB-
ITLU-AGV1:46179/
[rosmaster.master][INFO] 2024-12-19 13:48:08,267: -SERVICE [/z_localizer/pigen_map_server/get_loggers] /z_localizer/pigen_map_server rosrpc://user-IB-ITLU-AGV1:38525
`

It seems like the client node send the request to close the connect of master. So I grab the packet of the communication in port 11311. And I got this:
`
11:28:11.907822 IP (tos 0x0, ttl 64, id 40320, offset 0, flags [DF], proto TCP (6), length 60)
    localhost.45370 > localhost.11311: Flags [S], cksum 0xfe30 (incorrect -> 0x410c), seq 888600775, win 65495, options [mss 65495,sackOK,TS val 719902949 ecr 0,nop,wscale 7], length 0
11:28:11.907833 IP (tos 0x0, ttl 64, id 0, offset 0, flags [DF], proto TCP (6), length 60)
    localhost.11311 > localhost.45370: Flags [S.], cksum 0xfe30 (incorrect -> 0x0ae5), seq 1112207369, ack 888600776, win 65483, options [mss 65495,sackOK,TS val 719902949 ecr 719902949,nop,wscale 7], length 0
11:28:11.907845 IP (tos 0x0, ttl 64, id 40321, offset 0, flags [DF], proto TCP (6), length 52)
    localhost.45370 > localhost.11311: Flags [.], cksum 0xfe28 (incorrect -> 0x31a1), seq 1, ack 1, win 512, options [nop,nop,TS val 719902949 ecr 719902949], length 0
11:28:11.907883 IP (tos 0x0, ttl 64, id 40322, offset 0, flags [DF], proto TCP (6), length 197)
    localhost.45370 > localhost.11311: Flags [P.], cksum 0xfeb9 (incorrect -> 0x5dcc), seq 1:146, ack 1, win 512, options [nop,nop,TS val 719902949 ecr 719902949], length 145
11:28:11.907887 IP (tos 0x0, ttl 64, id 54441, offset 0, flags [DF], proto TCP (6), length 52)
    localhost.11311 > localhost.45370: Flags [.], cksum 0xfe28 (incorrect -> 0x3111), seq 1, ack 146, win 511, options [nop,nop,TS val 719902949 ecr 719902949], length 0
11:28:11.907902 IP (tos 0x0, ttl 64, id 40323, offset 0, flags [DF], proto TCP (6), length 218)
    localhost.45370 > localhost.11311: Flags [P.], cksum 0xfece (incorrect -> 0x40e4), seq 146:312, ack 1, win 512, options [nop,nop,TS val 719902949 ecr 719902949], length 166
11:28:11.907906 IP (tos 0x0, ttl 64, id 54442, offset 0, flags [DF], proto TCP (6), length 52)
    localhost.11311 > localhost.45370: Flags [.], cksum 0xfe28 (incorrect -> 0x306c), seq 1, ack 312, win 510, options [nop,nop,TS val 719902949 ecr 719902949], length 0
11:28:11.909939 IP (tos 0x0, ttl 64, id 54443, offset 0, flags [DF], proto TCP (6), length 2801)
    localhost.11311 > localhost.45370: Flags [P.], cksum 0x08e6 (incorrect -> 0xf69f), seq 1:2750, ack 312, win 512, options [nop,nop,TS val 719902951 ecr 719902949], length 2749
11:28:11.909949 IP (tos 0x0, ttl 64, id 40324, offset 0, flags [DF], proto TCP (6), length 52)
    localhost.45370 > localhost.11311: Flags [.], cksum 0xfe28 (incorrect -> 0x25b8), seq 312, ack 2750, win 497, options [nop,nop,TS val 719902951 ecr 719902951], length 0
11:28:11.918649 IP (tos 0x0, ttl 64, id 40325, offset 0, flags [DF], proto TCP (6), length 52)
    localhost.45370 > localhost.11311: Flags [F.], cksum 0xfe28 (incorrect -> 0x25a0), seq 312, ack 2750, win 512, options [nop,nop,TS val 719902959 ecr 719902951], length 0
11:28:11.918755 IP (tos 0x0, ttl 64, id 54444, offset 0, flags [DF], proto TCP (6), length 52)
    localhost.11311 > localhost.45370: Flags [F.], cksum 0xfe28 (incorrect -> 0x2596), seq 2750, ack 313, win 512, options [nop,nop,TS val 719902960 ecr 719902959], length 0
11:28:11.918763 IP (tos 0x0, ttl 64, id 40326, offset 0, flags [DF], proto TCP (6), length 52)
    localhost.45370 > localhost.11311: Flags [.], cksum 0xfe28 (incorrect -> 0x2595), seq 313, ack 2751, win 512, options [nop,nop,TS val 719902960 ecr 719902960], length 0
11:28:13.324032 IP (tos 0x0, ttl 64, id 11972, offset 0, flags [DF], proto TCP (6), length 60)
`

Finally, I check the client's ros debug log. I find the "Connection::drop(2)" but I have no idea why this occur.

`
^[[32m[DEBUG] [1734589864.847974551]: Received update for topic [/z_localizer/initialpose] (0 publishers)^[[0m
^[[32m[DEBUG] [1734589864.848046582]: Publisher update for [/z_localizer/initialpose]:  already have these connections: http://user-IB-ITLU-AGV1:33713/, ^[[0m
^[[32m[DEBUG] [1734589864.848075701]: Disconnecting from publisher [/z_localizer/localizer_rpc_server] of topic [/z_localizer/initialpose] at [http://user-IB-ITLU-AGV1:33713/]^[[0m
^[[32m[DEBUG] [1734589864.848099016]: Connection::drop(2)^[[0m
^[[32m[DEBUG] [1734589864.848170679]: TCP socket [19] closed^[[0m
`

**Comment by iceuw** [comment]
I have figure it out. It occurs because my devices is in local net with ip 192.168.0.100. And another computer (ip: 192.168.2.170) use ROS_MASTER_URI=http://192.168.0.100:11311. Then when I launch my program, They first use localhost as ros master. But after a little while, It will connect ros master by route with 192.168.2.170... Then all program detect the rosmaster uri is deferent with the begin. As the result, all node unregister the pub & sub.
